법령명,조문번호,조문제목,분류텍스트,정규식_분류,정규식_근거,gemini_분류,gemini_근거,일치여부
공무원 재해보상법,2,주관,제2조(주관) 이 법에 따른 공무원 재해보상제도의 운영에 관한 사항은 인사혁신처장이 주관한다.,규칙,기본값_구조추정,해당없음,업무 분장 규정,X
정부유가증권취급규칙,3,유가증권취급공무원,"①정부소유유가증권이나 정부보관유가증권은 각 중앙관서의 장 또는 그 위임을 받은 공무원이 임명한 공무원(이하 ""유가증권취급공무원""이라 한다)으로 하여금 이를 취급하게 하여야 한다.",규칙,의무부과,규칙,조건부 의무 부과,O
과학기술기본법,25,과학영재의 발굴 및 육성,② 과학기술정보통신부장관은 제1항에 따른 과학영재의 조기발굴과 육성을 위하여 이를 전문적으로 지원할 기관을 지정하고 그 지원업무 수행에 필요한 경비의 전부 또는 일부를 지원할 수 있다,규칙,권한부여,규칙,재량권 부여 (지원할 수 있다),O
한국임업전문학교 및 한국수산전문학교 설치령,17,(학비상환),②제1항에서 지원받은 학비라 함은 수업료ㆍ입학금ㆍ기숙사비 및 실습비등 교육과 관련하여 당해 학생에게 지원한 경비 및 물품대금등 모든 비용을 말한다.,해당없음,정의말한다,해당없음,정의 규정,O
국민권익위원회와 그 소속기관 직제 시행규칙,6,부패방지국,⑰ 삭제,해당없음,짧은텍스트,해당없음,삭제된 조항,O
공공주택 특별법 시행령,44,공공임대주택의 임대료,"⑤ 장기전세주택으로 공급하는 공공임대주택의 최초의 임대보증금은 해당 임대주택과 그 유형, 규모, 생활여건 등이 비슷한 인근 주택의 전세계약금액을 고려하여 국토교통부령으로 정하는 바에 따라 산정한 금액을 초과할 수 없다.",규칙,기본값_구조추정,규칙,구체적 상한액 산정 기준 제시 및 초과 금지,O
해양심층수의 개발 및 관리에 관한 법률 시행규칙,21,해양심층수개발업자에 대한 행정처분의 기준,"② 지방해양수산청장은 해양심층수개발업자에 대한 면허취소 또는 면허정지 처분의 내용을 별지 제15호서식의 해양심층수개발업자 행정처분대장에 기록ㆍ관리하되, 특별한 사유가 있는 경우를 제외하고는 전자적 방법으로 기록ㆍ관리하여야 한다.",규칙,의무부과,규칙,의무적 기록 관리 및 특별한 사유 예외 규정,O
민법법인 및 특수법인 등기규칙,3,등기소에 비치할 장부,① 등기소에는 접수장 및 「상업등기규칙」 제22조제1항의 장부를 비치하여야 한다.,규칙,의무부과,규칙,구체적인 장부 비치 의무 부과,O
가축분뇨의 자원화 및 이용 촉진에 관한 규칙,12,규제의 재검토,제12조(규제의 재검토) 농림축산식품부장관은 제7조에 따른 환경친화축산농장의 지정기준에 대하여 2017년 1월 1일을 기준으로 3년마다(매 3년이 되는 해의 1월 1일 전까지를 말한다) 그 타당성을 검토하여 개선 등의 조치를 하여야 한다.,규칙,의무부과,규칙,"구체적인 시점 및 주기 명시, 타당성 검토 및 조치 의무 부과",O
공직선거관리규칙,61,정강ㆍ정책홍보물등의 제출,"①법 제138조(정강ㆍ정책홍보물의 배부제한등)제1항의 규정에 의한 정강ㆍ정책홍보물에는 작성근거, 제작정당명과 인쇄소의 명칭ㆍ주소ㆍ전화번호를 표시하여야 한다.",규칙,의무부과,규칙,필수적으로 표시해야 하는 사항 명시,O
필수업무 지정 및 종사자 보호ㆍ지원에 관한 법률,2,정의,제2조(정의) 이 법에서 사용하는 용어의 뜻은 다음 각 호와 같다.,해당없음,정의규정,해당없음,정의 규정,O
산업단지 인ㆍ허가 절차 간소화를 위한 특례법,6,산업단지계획심의위원회,"③ 중앙산업단지계획심의위원회 및 지방산업단지계획심의위원회(이하 ""심의위원회""라 한다)의 위원장은 제2항제3호부터 제9호까지의 규정에 해당하는 위원을 임명하기 위하여 같은 항 각 호의 위원이 속한 위원회의 위원장에게 위원의 추천을 요청하여야 하며, 위원의 추천을 요청받은 위원장은 그 요청을 받은 날부터 7일 이내에 위원을 추천하여야 한다.",해당없음,약칭규정,규칙,조건부 의무 부과 및 기한 명시,X
범죄인 인도법,20,인도구속영장의 집행,"④ 사법경찰관리 등이 범죄인을 구속할 때에는 구속의 이유와 변호인을 선임(選任)할 수 있음을 알려주고, 신속히 범죄인 소재지를 관할하는 지방검찰청 또는 그 지청(支廳)의 소속 검사에게 범죄인을 인치하여야 한다.",규칙,의무부과,규칙,조건부 의무 부과,O
사회보장기본법 시행령,16,중장기 사회보장 재정추계의 실시 시기 등,"③ 보건복지부장관은 제2항에 따라 실시한 재정추계 결과를 위원회의 심의를 거친 후 1개월 이내에 관계 중앙행정기관의 장에게 통보하고, 그 내용을 홈페이지 게재 등의 방법으로 공표해야 한다.",규칙,"의무부과,구체적수치,기한규정",규칙,조건부 의무 부과 및 기한 명시,O
위험물안전관리법,39,과태료,④ 삭제,해당없음,짧은텍스트,해당없음,삭제된 조항,O
저작권법 시행규칙,19,저작권신탁관리업 변경허가 등,③ 법 제105조제4항에 따라 저작권대리중개업 변경신고를 하려는 자는 별지 제50호서식의 저작권대리중개업 변경신고서에 신고증 및 변경사항을 증명하는 서류를 첨부하여 제출해야 한다.,규칙,의무부과,규칙,구체적인 절차와 서류 제출 의무 명시,O
새만금사업 추진 및 지원에 관한 특별법,36,토지의 공급,"② 공사는 다른 법령에 특별한 규정이 있는 경우를 제외하고는 다음 각 호의 사항이 포함된 토지의 공급에 관한 기준(이하 ""공급기준""이라 한다)을 정하여 시행하여야 한다.",규칙,의무부과,규칙,구체적인 사항을 포함한 기준 제정 및 시행 의무 부과,O
방송법,90,방송사업자의 의무,①제87조제1항 각 호에 따른 방송사업자는 제88조제1항제1호 및 제2호에 따른 시청자위원회의 의견제시 또는 시정요구를 받은 경우에는 특별한 사유가 없으면 이를 수용하여야 한다.,규칙,의무부과,원칙,'특별한 사유가 없으면'이라는 형량 가능성 내포 및 시청자위원회 의견 수용이라는 추상적 의무,X
선박안전법,74,결함신고에 따른 확인 등,③해양수산부장관은 제2항의 규정에 따른 확인 결과 결함의 내용이 중대하여 해당선박을 항해에 계속하여 사용하는 것이 해당 선박 및 승선자에게 위험을 초래할 우려가 있다고 인정되는 경우에는 해양수산부령으로 정하는 바에 따라 해당결함이 시정될 때까지 출항정지를 명할 수 있다.,규칙,권한부여,규칙,"구체적인 요건(결함의 중대성, 위험 초래 우려) 충족 시 출항정지라는 법률효과 발생",O
경찰수사규칙,113,고소인등의 이의신청,① 법 제245조의7제1항에 따른 이의신청은 별지 제125호서식의 불송치 결정 이의신청서에 따른다.,규칙,확정명시,규칙,구체적인 서식에 따른 이의신청 절차 명시,O
군인연금법 시행령,54,심사의 청구,② 제1항에 따라 심사 청구서를 받은 기관의 장은 10일 이내에 변명서와 그 밖에 필요한 자료를 첨부하여 「군인 재해보상법」 제48조에 따른 군인재해보상연금재심위원회에 보내야 한다.,규칙,"구체적수치,기한규정",규칙,구체적 기한(10일 이내)을 정하여 의무 부과,O
국고금 관리법,31,국고금의 통합관리 등,"③ 재정경제부장관은 국고금의 수급을 위하여 필요하다고 인정할 때에는 예산 또는 기금운용계획의 집행에 지장을 주지 아니하는 범위에서 제1항에 따른 통합관리를 하지 아니하는 회계ㆍ계정, 제2항에 따른 통합계정(이하 ""통합계정""이라 한다) 및 「공공자금관리기금법」 제2조에 따른 공공자금관리기금의 자금을 세입세출예산 또는 기금운용계획 외로 상호 예탁할 수 있다. ",규칙,의무부과,규칙,"재정경제부장관에게 통합관리하지 아니하는 회계 등의 자금을 상호 예탁할 수 있는 권한을 부여하고, 그 요건을 명시함",O
국립대학법인 서울대학교 설립ㆍ운영에 관한 법률,34,유사명칭 등의 사용금지,제34조(유사명칭 등의 사용금지) 국립대학법인 서울대학교가 아닌 자는 국립대학법인 서울대학교의 명칭과 표장(標章) 또는 이와 유사한 것을 사용하지 못한다.,규칙,의무부과,규칙,구성요건(국립대학법인 서울대학교가 아닌 자) 충족 시 법률효과(명칭 및 표장 유사물 사용 금지)가 명확하게 확정됨,O
고엽제후유의증 등 환자지원 및 단체설립에 관한 법률,13,실태조사,"② 국가보훈부장관은 제1항에 따른 실태조사를 위하여 필요한 경우에는 관계 중앙행정기관의 장, 지방자치단체의 장 또는 「공공기관의 운영에 관한 법률」에 따른 공공기관의 장(이하 ""관계 기관의 장""이라 한다)에게 자료의 제출을 요청할 수 있다. 이 경우 자료의 제출을 요청받은 관계 기관의 장은 정당한 사유가 없으면 이에 따라야 한다.",규칙,조건부명령,규칙,자료 제출 요청에 대한 조건부 의무 부과,O
5ㆍ18민주유공자예우 및 단체설립에 관한 법률,24,업체등의 신고,③ 제2항의 경우 관계 공무원은 그 권한을 표시하는 증표를 지니고 이를 관계인에게 내보여야 한다.,규칙,기본값_구조추정,규칙,관계 공무원의 의무를 명확히 규정,O
공무원 재해보상법 시행령,84,인사혁신처장의 업무 위탁,"제84조(인사혁신처장의 업무 위탁) 법 제61조제1항제10호에서 ""대통령령으로 정하는 사항""이란 다음 각 호의 사항을 말한다.",해당없음,정의말한다,해당없음,정의 규정,O
기술의 이전 및 사업화 촉진에 관한 법률 시행령,34,기술신탁관리업의 허가,③ 산업통상부장관은 제1항 및 제2항에 따라 제출받은 서류가 다음 각 호의 어느 하나에 해당하는 경우에는 기간을 정하여 이를 보완하게 할 수 있다.,규칙,권한부여,규칙,조건부 의무 부과 (보완 요구),O
군사법원법,289,국가소추주의,제289조(국가소추주의) 공소는 군검사가 제기하여 수행한다.,규칙,기본값_구조추정,규칙,명확한 의무 부과,O
정보통신 진흥 및 융합 활성화 등에 관한 특별법 시행령,24,중소기업 등의 연구개발 지원 방법 등,③ 제2항의 지원에 필요한 세부사항은 과학기술정보통신부장관이 정하여 고시한다.,규칙,기본값_구조추정,해당없음,단순 위임,X
공직선거관리규칙,109,투표를 실시하지 아니할 때의 공고ㆍ통지,②읍ㆍ면ㆍ동위원회는 법 제188조제3항 또는 법 제190조제3항 및 법 제191조제3항(법 제188조제3항을 준용하는 경우를 말한다)에 따라 선거일의 투표개시시각부터 투표마감시각까지에 투표를 실시하지 아니할 사유가 발생된 때에는 별지 제59호서식의(나)에 의하여 선거당일에 그 사실을 투표소의 입구에 게시하여야 한다.,규칙,의무부과,규칙,구체적 절차 및 의무 부과,O
지방공기업법 시행령,2,요금에 관한 규정의 준용,②지방자치단체의 장은 제1항의 규정에 의하여 법 제22조의 규정을 준용하고자 하는 때에는 대상사업의 명칭을 그 지방자치단체의 공보에 고시하여야 한다.,규칙,"조건부명령,의무부과",규칙,지방자치단체의 장에게 공보 고시 의무 부과,O
석면피해구제법 시행령,1,,제1장 총칙,해당없음,장절관제목,해당없음,장 제목,O
가축 및 축산물 이력관리에 관한 법률 시행규칙,16,수입산이력축산물에 대한 이력번호 부여방법 등,"제16조(수입산이력축산물에 대한 이력번호 부여방법 등) 법 제13조제1항 및 제2항에 따른 이력번호의 부여방법, 수입유통식별표의 표시사항과 규격, 부착방법 및 관리 등은 별표 11과 같다.",규칙,기본값_구조추정,해당없음,다른 조항 및 별표로 위임,X
위생용품 관리법,10,기준 및 규격,"② 식품의약품안전처장은 제1항에 따른 기준 및 규격이 고시되지 아니한 위생용품의 기준 및 규격을 인정받으려는 자에게 성분, 제조방법 등 총리령으로 정하는 사항을 제출하게 하여 「식품ㆍ의약품분야 시험ㆍ검사 등에 관한 법률」 제6조제2항제6호에 따른 위생용품 시험ㆍ검사기관의 검토를 거쳐 제1항에 따른 기준 및 규격이 고시 될 때까지 그 위생용품의 기준과 규격으",규칙,권한부여,해당없음,다른 법률 및 하위 규정으로 위임,X
조달사업에 관한 법률,23,포상금의 지급,"① 조달청장은 조달사업을 수행하는 공무원의 직무에 관한 뇌물수수(收受) 행위 또는 불공정 조달행위를 신고하거나 제보하고 그 신고나 제보를 증명할 수 있는 증거자료를 제출한 사람(이하 ""신고자등""이라 한다)에게 예산의 범위에서 포상금을 지급할 수 있다.",규칙,권한부여,규칙,포상금 지급 가능성 명시 (예산 범위 내),O
진실ㆍ화해를 위한 과거사정리 기본법,8,위원의 직무상 독립과 신분보장,③제2항제1호의 경우에는 재적위원 3분의 2 이상의 찬성에 의한 의결을 거쳐 위원장의 제청으로 대통령이 면직한다.,규칙,구체적수치,규칙,면직 요건 및 절차 명확히 규정,O
고등교육법 시행령,60,전문학사학위의 종류,제60조(전문학사학위의 종류) 법 제50조제2항의 규정에 의한 전문학사학위의 종류는 학칙으로 정한다.,규칙,기본값_구조추정,해당없음,학칙으로 정하도록 위임,X
소재ㆍ부품ㆍ장비산업 경쟁력 강화 및 공급망 안정화를 위한 특별조치법 시행령,12,전문위원회 등,"② 각 전문위원회 및 법 제8조제4항에 따른 특별위원회(이하 ""특별위원회""라 한다)는 각각 위원장 1명을 포함한 15명 이내의 위원으로 구성한다.",해당없음,약칭규정,규칙,위원 수 명확히 규정,X
병원체자원의 수집ㆍ관리 및 활용 촉진에 관한 법률 시행령,18,병원체자원 정보시스템의 운영,제18조(병원체자원 정보시스템의 운영) 질병관리청장은 법 제21조제1항 전단에 따른 병원체자원 정보시스템의 효율적 운영을 위하여 필요하다고 인정하는 경우에는 해당 정보시스템의 평가ㆍ개선에 관한 기준을 수립ㆍ시행할 수 있다.,규칙,권한부여,규칙,필요 시 기준 수립 및 시행 가능성 명시,O
전기안전관리법 시행규칙,8,정기검사의 대상ㆍ기준 및 절차 등,"④ 전기사업자 또는 자가용전기설비의 소유자 또는 점유자는 정기검사에 불합격한 경우 적합하지 않은 부분에 대해 검사완료일부터 3개월 이내에 재검사를 받아야 한다. 다만, 안전공사는 별표 4 제1호(5)(나)에 따른 태양광발전소의 부지 및 구조물이 정기검사에 불합격한 경우로서 전기사업자 또는 자가용전기설비의 소유자 또는 점유자가 계절적ㆍ환경적 요인으로 개보수 ",규칙,"권한부여,구체적수치,기한규정",규칙,재검사 기한 및 예외 사항 명시,O
국제기구 분담금 관리에 관한 법률,6,국제기구 분담금 납부실적에 대한 자체평가 등,① 중앙행정기관의 장은 소관 국제기구 분담금의 전년도 납부실적 및 납부목적에 부합하는지 여부에 대하여 매년 자체평가를 실시하여야 한다.,규칙,의무부과,규칙,구체적인 의무(자체평가 실시)를 명확하게 부과,O
선원법,79,선내 안전ㆍ보건 및 사고예방 기준,② 선내안전보건기준의 구체적인 사항은 해양수산부장관이 정하여 고시한다.,규칙,기본값_구조추정,해당없음,구체적인 사항을 하위 법령에 위임,X
아이돌봄 지원법,35,벌칙,② 다음 각 호에 해당하는 자는 1년 이하의 징역 또는 1천만원 이하의 벌금에 처한다.,규칙,벌칙,규칙,구성요건 충족 시 형벌 부과라는 명확한 법률효과 규정,O
한국농어촌공사 및 농지관리기금법 시행규칙,16,영농복귀 지원,① 공사는 농지를 임대하고 전업한 농업인이 법 제21조제1항에 따라 영농에 복귀하려는 경우로서 그 농지가 제3자에게 임대된 경우에는 공사가 소유하고 있거나 임차한 농지를 우선적으로 임대할 수 있다.,규칙,권한부여,규칙,우선 임대라는 구체적인 법률효과 규정,O
초ㆍ중등교육법,30,학교의 통합ㆍ운영,"① 학교의 설립자ㆍ경영자는 효율적인 학교 운영을 위하여 필요하면 지역 실정에 따라 초등학교ㆍ중학교, 중학교ㆍ고등학교 또는 초등학교ㆍ중학교ㆍ고등학교의 시설ㆍ설비 및 교원 등을 통합하여 운영할 수 있다. 이 경우 해당 학교의 학생 및 학부모의 의견을 수렴하여야 한다.",규칙,의무부과,원칙,효율적인 학교 운영이라는 추상적 가치 실현을 위한 재량적 조치 허용 및 의견 수렴 의무,X
검찰사건사무규칙,150,,제1절 총칙,해당없음,장절관제목,해당없음,장/절 제목,O
공인중개사법 시행령,5,시험방법 및 시험의 일부면제,③제2항의 규정에 따라 제1차시험과 제2차시험을 동시에 시행하는 경우에는 제1차시험에 불합격한 자의 제2차시험은 무효로 한다.,규칙,"조건부명령,효과확정",규칙,조건부 법률효과 확정 (제1차시험 불합격 시 제2차시험 무효),O
금강수계 물관리 및 주민지원 등에 관한 법률 시행규칙,34,수질 유지기간,"제34조(수질 유지기간) 법 제21조제1항제2호에서 ""기후에너지환경부령으로 정하는 기간""이란 최근 2년간을 말한다.",해당없음,정의말한다,해당없음,정의 규정 ('~란 ~을 말한다'),O
도시 및 주거환경정비법 시행령,18,,제3장 정비사업의 시행,해당없음,장절관제목,해당없음,장/절 제목,O
산업발전법 시행령,14,기업구조개선 기관전용 사모집합투자기구에 대한 기금의 출자,"① 법 제24조제1항에서 ""대통령령으로 정하는 기금""이란 별표 3의 기금을 말한다.",해당없음,정의말한다,해당없음,정의 규정 ('~란 ~을 말한다'),O
항공안전법 시행규칙,90,조종사 등이 받은 자격증명의 효력,② 부조종사 또는 사업용 조종사의 자격증명을 받은 사람이 같은 종류의 항공기에 대하여 운송용 조종사 자격증명을 받은 경우에는 종전의 자격증명에 관한 항공기 형식의 한정 또는 계기비행증명ㆍ조종교육증명에 관한 한정은 새로 받은 자격증명에도 유효하다.,규칙,기본값_구조추정,규칙,종전 자격증명의 효력에 대한 명확한 규정,O
철도안전법 시행령,20,관제자격증명 갱신 및 취득절차의 일부 면제,"제20조의5(관제자격증명 갱신 및 취득절차의 일부 면제) 관제자격증명의 갱신 및 취득절차의 일부 면제에 관하여는 제19조 및 제20조를 준용한다. 이 경우 ""운전면허""는 ""관제자격증명""으로, ""운전교육훈련""은 ""관제교육훈련""으로, ""운전면허시험 중 필기시험""은 ""관제자격증명시험 중 학과시험""으로 본다.",규칙,간주규정,규칙,준용 규정을 통해 구체적인 절차 및 용어 대체 명시,O
푸드테크산업 육성에 관한 법률 시행규칙,5,전문인력 양성기관의 지정 신청 등,"③ 영 제8조제2항에 따른 신청을 받은 관계 중앙행정기관의 장은 「전자정부법」 제36조제1항에 따른 행정정보의 공동이용을 통해 법인 등기사항증명서(법인인 경우만 해당한다) 및 사업자등록증명(주민등록번호가 제외된 사업자등록증명을 말한다)을 확인해야 한다. 다만, 신청인이 사업자등록증명의 확인에 동의하지 않는 경우에는 해당 서류를 첨부하게 해야 한다.",규칙,의무부과,규칙,행정정보 공동이용을 통한 서류 확인 의무 및 예외 사항 명시,O
대통령기록물 관리에 관한 법률 시행령,10,전직 대통령 등의 방문 열람,① 대통령기록관의 장은 전직 대통령이 법 제18조제1항제1호에 따라 대통령기록물을 열람하려는 경우에는 열람을 위한 전용 장소 및 시설이나 그 밖에 열람에 필요한 편의를 제공하여야 한다. 이 경우 열람을 위한 전용 장소 및 시설은 대통령기록관 내에 두거나 「공공기록물 관리에 관한 법률」 제3조제5호에 따른 영구기록물관리기관의 장과 협의하여 해당 영구기록물관리,규칙,권한부여,규칙,전용 장소 및 시설 제공 의무 명시,O
대ㆍ중소기업 상생협력 촉진에 관한 법률 시행령,14,약정서 기재사항 등,"③ 법 제21조제3항제2호에서 ""대통령령으로 정하는 기간""이란 90일을 말한다. 다만, 거래 관행 등 거래의 특성을 고려하여 중소벤처기업부장관이 달리 정하여 고시하는 경우에는 그에 따른 기간을 말한다.",해당없음,정의말한다,규칙,"구체적인 기간(90일)을 명시하고, 예외적인 경우를 규정",X
새마을금고법 시행령,10,선거관리위원회의 구성ㆍ운영ㆍ직무 등,③ 법 제23조제2항에 따라 금고의 회원이 아닌 사람으로서 선거관리위원회의 위원이 될 수 있는 사람은 다음 각 호의 어느 하나에 해당하는 사람으로 한다.,규칙,기본값_구조추정,해당없음,정의 규정,X
공공폐자원관리시설의 설치ㆍ운영 및 주민지원 등에 관한 특별법,14,공공폐자원관리시설 설치계획의 수립 및 승인 등,⑥ 기후에너지환경부장관은 제3항부터 제5항까지의 규정에 따라 설치계획에 대한 협의를 거친 경우 대통령령으로 정하는 방법에 따라 설치계획을 공고하여야 한다.,규칙,"의무부과,절차규정",규칙,조건부 의무 부과,O
빈집 및 소규모주택 정비에 관한 특례법 시행령,41,임대주택 건설에 따른 특례,② 토지주택공사등은 법 제17조제3항 또는 제18조제1항에 따라 소규모주택정비사업을 시행하는 경우에는 제1항 각 호의 순위에도 불구하고 해당 사업에 따라 공급되는 공공임대주택을 우선하여 인수할 수 있다.,규칙,권한부여,규칙,우선권 부여,O
수상에서의 수색ㆍ구조 등에 관한 법률,16,구조본부 등의 조치,② 제1항에 따라 구조의 지시 또는 요청을 받은 구조대의 장은 구조상황을 수시로 관할 구조본부의 장 또는 소방관서의 장에게 보고 하거나 통보하여야 한다.,규칙,"의무부과,절차규정",규칙,의무 부과,O
식물신품종 보호법,103,심결 등에 대한 소,⑦ 특허법원의 판결에 대하여는 대법원에 상고할 수 있다.,규칙,권한부여,규칙,절차 규정,O
발명진흥법,23,지역지식재산센터,①지역 중소기업과 주민의 산업재산권에 관한 인식을 제고하고 산업재산권의 창출ㆍ보호 및 활용을 지원하기 위하여 지역별로 지역지식재산센터를 둘 수 있다.,규칙,기본값_구조추정,해당없음,둘 수 있다 (재량적 허용),X
금융지주회사법,45,은행지주회사의 주요출자자에 대한 신용공여한도 등,"⑦제1항 내지 제6항의 규정에 의한 자회사등의 범위, 신용공여의 기준, 자기자본 및 자기자본의 순합계액의 산정방법은 대통령령으로 정한다.",규칙,기본값_구조추정,해당없음,단순 위임,X
첨단재생의료 및 첨단바이오의약품 안전 및 지원에 관한 법률,11,첨단재생의료 치료의 동의 등,② 치료대상자는 재생의료기관에 제1항에 따른 동의서 사본의 발급을 요청할 수 있다. 이 경우 요청을 받은 재생의료기관은 정당한 사유가 없으면 이를 거부하여서는 아니 된다.,규칙,의무부과,규칙,정당한 사유 없으면 거부 금지 (조건부 의무 부과),O
주택법,93,보고ㆍ검사 등,"② 제1항에 따른 검사를 할 때에는 검사 7일 전까지 검사 일시, 검사 이유 및 검사 내용 등 검사계획을 검사를 받을 자에게 알려야 한다. 다만, 긴급한 경우나 사전에 통지하면 증거인멸 등으로 검사 목적을 달성할 수 없다고 인정하는 경우에는 그러하지 아니하다.",규칙,통지알림,규칙,원칙적 통지 의무 부과 (예외 인정),O
