법령명,조문번호,조문제목,분류텍스트,정규식_분류,정규식_근거,gemini_분류,gemini_근거,일치여부
지방자치법,197,특례의 인정,① 서울특별시의 지위ㆍ조직 및 운영에 대해서는 수도로서의 특수성을 고려하여 법률로 정하는 바에 따라 특례를 둘 수 있다.,규칙,기본값_구조추정,해당없음,법률로 정하는 바에 따라 (추상적 위임),X
비료관리법,14,제조 원료의 장부기재 및 보존,① 비료생산업자등은 비료의 종류별로 비료제조에 사용되는 원료의 종류ㆍ구입처ㆍ수량 등을 장부(전자화된 장부를 포함한다)에 기재하고 이를 3년간 보존하여야 한다.,규칙,의무부과,규칙,구체적 의무(장부기재 및 보존)와 기간 명시,O
국토교통부와 그 소속기관 직제 시행규칙,7,국토도시실,㉒ 건축안전과장은 다음 사항을 분장한다.,해당없음,업무분장,해당없음,업무 분장 규정,O
채무자 회생 및 파산에 관한 법률,200,영업 또는 재산의 양도 등,②제1항의 경우 대가를 회생채권자ㆍ회생담보권자ㆍ주주ㆍ지분권자에게 분배하는 때에는 그 분배의 방법도 정하여야 한다.,규칙,"조건부명령,의무부과",규칙,조건부 의무 부과 (분배 시 방법 정해야 함),O
군인연금법 시행규칙,4,복무기간의 계산방법,② 제1항에도 불구하고 전투에 참가한 기간이 있는 군인의 복무기간은 제1항에 따른 복무기간에 전투종료 연월일에서 전투참가 연월일을 뺀 수에 1을 더한 합에 2를 곱한 연월일수로 계산한 기간을 더하여 계산한다.,규칙,기본값_구조추정,규칙,구체적인 계산 방법 명시,O
소방시설 설치 및 관리에 관한 법률 시행규칙,37,점검능력 평가의 신청 등,"④ 제1항부터 제3항까지에서 규정한 사항 외에 점검능력 평가 등 업무수행에 필요한 세부 규정은 평가기관이 정하되, 소방청장의 승인을 받아야 한다.",규칙,확인받음,규칙,"위임 규정이나, 승인 요건이 명확하여 규칙으로 분류 가능",O
별정우체국법,25,비업무상 장해연금의 지급정지,② 제1항에 따라 비업무상 장해연금의 지급이 정지된 자가 다시 퇴직한 경우에는 그 퇴직 당시 대통령령으로 정하는 정도의 장애 상태에 있는 경우에만 재(再)퇴직 당시의 기준소득월액을 기초로 비업무상 장해연금의 금액을 다시 정한다.,규칙,조건부명령,규칙,"구성요건(지급정지된 자가 다시 퇴직, 대통령령으로 정하는 정도의 장애 상태) 충족 시 법률효과(연금 금액 재산정) 발생",O
고등교육법 시행령,24,대학원위원회,"③제1항의 규정에 의한 대학원위원회는 학교의 장이 지명하는 7인이상의 위원으로 구성하되, 그 구성 및 운영에 관한 사항은 학칙으로 정한다.",규칙,기본값_구조추정,규칙,"구성요건(대학원위원회) 충족 시 법률효과(7인 이상 위원 구성, 학칙으로 정함) 발생",O
광산안전법,1,목적,제1조(목적) 이 법은 광산근로자에 대한 위해(危害)를 방지하고 아울러 광해(鑛害)를 방지함으로써 지하자원의 합리적인 개발을 도모함을 목적으로 한다.,해당없음,목적규정,해당없음,목적 규정,O
자본시장과 금융투자업에 관한 법률 시행령,78,다자간매매체결회사의 업무기준 등,"⑤ 법 제78조제3항제4호에서 ""대통령령으로 정하는 것""이란 매매가격ㆍ거래량 및 매매체결의 시간 등 매매체결대상상품의 매매체결에 관한 정보를 말한다.",해당없음,정의말한다,해당없음,정의 규정 ('~란 ~을 말한다'),O
광업법,33,현장조사 및 광구경계측량의 신청,③산업통상부장관은 제2항에 따른 광구경계측량의 신청을 받으면 「공간정보의 구축 및 관리 등에 관한 법률」 제44조제2항에 따라 측량업의 등록을 한 자에게 그 경계측량을 대행하게 할 수 있다.,규칙,권한부여,규칙,구성요건(신청을 받으면) 충족 시 법률효과(측량업 등록자에게 대행하게 할 수 있음) 발생,O
야생생물 보호 및 관리에 관한 법률 시행규칙,26,인공증식 등을 위한 포획ㆍ채취 등의 허가대상 야생생물 등,"② 법 제19조제1항제5호에서 ""기후에너지환경부령으로 정하는 기준 및 방법 등""이란 다음 각 호의 것을 말한다.",해당없음,정의말한다,해당없음,정의 규정,O
국가공간정보 기본법,1,목적,제1조(목적) 이 법은 국가공간정보체계의 효율적인 구축과 종합적 활용 및 관리에 관한 사항을 규정함으로써 국토 및 자원을 합리적으로 이용하여 국민경제의 발전에 이바지함을 목적으로 한다.,해당없음,목적규정,해당없음,목적 규정,O
선거연수원 운영규칙,16,등록,"①교육대상자 또는 연수대상자(이하 ""교육ㆍ연수대상자""라 한다)로 선발된 사람은 해당 교육개시시각 전까지 소정의 등록절차를 마쳐야 한다.",해당없음,정의규정,규칙,조건부 의무 부과,X
지방교육행정기관 예산성과금 운영규칙,11,자체심사위원회,④이 규칙에서 규정한 사항 외에 자체심사위원회의 운영 등에 관하여 필요한 사항은 교육감이 정한다.,규칙,기본값_구조추정,해당없음,단순 위임,X
의료기기법 시행규칙,54,의료기기통합정보시스템 운영 등,"① 법 제31조의3제2항에 따라 의료기기 제조업자ㆍ수입업자가 의료기기통합정보시스템에 등록(변경등록을 포함한다. 이하 같다)하여야 하는 정보(이하 ""의료기기정보등""이라 한다)는 다음 각 호와 같다.",규칙,확정명시,규칙,조건부 의무 부과,O
산업집적활성화 및 공장설립에 관한 법률 시행령,58,산업단지구조고도화사업의 대행,⑤ 사업시행자는 제4항에 따라 계약을 체결한 산업단지구조고도화사업의 대행자가 성실하게 사업을 시행하도록 지도ㆍ감독하여야 한다.,규칙,의무부과,원칙,성실 이행을 위한 지도ㆍ감독 의무 부과 (추상적 의무),X
부동산등기법,78,공동저당의 등기,③ 제2항의 공동담보목록은 등기기록의 일부로 본다.,규칙,기본값_구조추정,규칙,법률효과 확정 (등기기록의 일부로 간주),O
어장관리법 시행규칙,2,어장관리해역의 지정 방법과 절차 등,② 제1항에 따라 협의를 요청받은 시ㆍ도지사 및 시장ㆍ군수ㆍ구청장은 특별한 사유가 없는 한 그 요청을 받은 날부터 30일 이내에 해양수산부장관에게 의견을 제출하여야 한다.,규칙,"의무부과,구체적수치,절차규정,기한규정",규칙,조건부 의무 부과 (특별한 사유 없는 한 30일 이내 의견 제출),O
학교복합시설 설치 및 운영ㆍ관리에 관한 법률 시행령,4,학교복합시설의 운영ㆍ관리,② 운영관리자는 학교의 교육활동을 위하여 필요한 경우에는 학생과 교직원이 우선적으로 학교복합시설을 이용할 수 있도록 해야 한다.,규칙,"조건부명령,의무부과",원칙,우선 이용 보장 의무 (교육활동을 위한 필요성 고려),X
석유 및 석유대체연료 사업법 시행령,34,석유대체연료 제조ㆍ수출입업의 등록,④ 제1항제2호 및 제3항에 따른 석유대체연료 저장시설의 범위와 제3항에 따른 석유대체연료 내수판매량의 산출방법에 관한 사항은 산업통상부령으로 정한다.,규칙,기본값_구조추정,해당없음,단순 위임 (구체적 사항을 하위 법령에 위임),X
디지털의료제품법 시행규칙,15,임상시험기관 외 실시 승인 등,⑤ 제1항 및 제2항에도 불구하고 법 제39조에 따라 임상시험계획 등에 대하여 사전 검토를 받은 자가 제49조제3항에 따른 사전 검토 결과 통지서를 제출하는 경우에는 제1항 각 호 및 제2항 각 호의 자료 중 사전 검토 결과 적합하다는 판정을 받은 사항에 대한 자료는 제출하지 않을 수 있다.,규칙,기본값_구조추정,규칙,조건부 의무 면제 규정,O
직업교육훈련 촉진법,4,직업교육훈련 기본계획의 수립ㆍ시행,② 기본계획에는 다음 각 호의 사항이 포함되어야 한다.,규칙,기본값_구조추정,해당없음,목록 규정,X
형사사법절차에서의 전자문서 이용 등에 관한 규칙,29,전자기록의 열람 등에 따른 수수료,"① 전자기록의 열람, 출력 또는 복제를 신청할 경우 납부하여야 할 수수료의 금액은 별표 2와 같다.",규칙,확정명시,규칙,구체적 수치(별표)에 따른 의무 부과,O
자연환경보전법,11,자연환경정보망의 구축ㆍ운영 등,②기후에너지환경부장관은 관계행정기관의 장에게 자연환경정보망의 구축ㆍ운영에 필요한 자료의 제출을 요청할 수 있다. 이 경우 관계행정기관의 장은 특별한 사유가 없으면 그 요청에 따라야 한다.,규칙,기본값_구조추정,규칙,조건부 의무 부과 (특별한 사유가 없으면 따라야 함),O
전기통신기본법 시행령,39,,제39조 삭제,해당없음,짧은텍스트,해당없음,삭제된 조항,O
조세특례제한법 시행령,98,준공후미분양주택의 취득자에 대한 양도소득세의 과세특례,"⑤ 법 제98조의6제1항을 적용할 때 해당 준공후미분양주택의 임대기간(이하 이조에서 ""임대기간""이라 한다)은 다음 각 호의 방법에 따라 계산한다.",규칙,기본값_구조추정,해당없음,계산 방법 규정 (규범적 명령 아님),X
특허법,29,특허요건,② 특허출원 전에 그 발명이 속하는 기술분야에서 통상의 지식을 가진 사람이 제1항 각 호의 어느 하나에 해당하는 발명에 의하여 쉽게 발명할 수 있으면 그 발명에 대해서는 제1항에도 불구하고 특허를 받을 수 없다.,규칙,기본값_구조추정,규칙,구성요건 충족 시 특허 불허라는 확정적 법률효과 규정,O
보건복지부와 그 소속기관 직제 시행규칙,7,장애인정책국,"① 장애인정책국장은 고위공무원단에 속하는 일반직공무원으로 보하되, 그 직위의 직무등급은 나등급으로 한다.",규칙,기본값_구조추정,규칙,직위 및 등급 지정이라는 확정적 규정,O
형사사법절차에서의 전자문서 이용 등에 관한 법률 시행령,14,수사 관련 자료의 요구,① 수사기관등은 「형사소송법」 제199조제2항에 따라 공무소나 그 밖의 공사단체에 자료의 제출을 요구하는 경우 전자적 송달 또는 통지의 방법으로 할 수 있다.,규칙,권한부여,규칙,전자적 송달 또는 통지 방법으로 할 수 있다는 허용 규정 (법률효과 특정),O
검찰사건사무규칙,89,압수ㆍ수색 또는 검증 영장의 청구,④ 검사는 사법경찰관등의 압수ㆍ수색 또는 검증 영장의 신청을 검토하여 압수ㆍ수색 또는 검증을 할 만한 상당한 이유가 없다고 인정할 때에는 다음 각 호의 구분에 따른 서식에 그 이유를 구체적으로 기재하여 압수ㆍ수색 또는 검증 영장의 신청을 기각한다.,원칙,상당한판단,규칙,상당한 이유가 없다고 인정할 때 기각한다는 확정적 의무 규정,X
가족관계의 등록 등에 관한 법률,16,등록부의 기록절차,"제16조(등록부의 기록절차) 등록부는 신고, 통보, 신청, 증서의 등본, 항해일지의 등본 또는 재판서에 의하여 기록한다.",규칙,기본값_구조추정,규칙,기록의 근거를 명확히 확정,O
관세법,202,설비의 유지의무 등,③ 제2항에 따라 작업을 하는 경우의 반출검사 등에 관하여는 제187조를 준용한다.,규칙,준용규정,규칙,준용 규정을 통해 특정 절차의 적용 확정,O
점자법,15,한글 점자의 날,② 국가와 지방자치단체는 제1항에 따른 한글 점자의 날 기념 행사 등을 실시할 수 있다.,규칙,권한부여,규칙,"국가 및 지자체의 행사 실시 '할 수 있다'는 재량권 부여이나, 법률효과(행사 실시)가 특정되어 있으므로 규칙으로 분류",O
지방세기본법 시행령,88,지방세법규해석심사위원회의 구성 및 운영,"⑧ 위원장은 지방세법규해석심사위원회의 회의를 소집하고, 그 의장이 된다.",규칙,기본값_구조추정,규칙,위원장의 직무를 명확히 확정,O
해양사고의 조사 및 심판에 관한 법률,24,,제2장의2 심판원의 관할,해당없음,짧은텍스트,해당없음,장 제목,O
국제입양에 관한 법률 시행령,5,협정에 포함되어야 하는 사항,제5조(협정에 포함되어야 하는 사항) 법 제31조제1항에 따른 양자 또는 다자 협정에는 다음 각 호의 사항이 포함되어야 한다.,규칙,기본값_구조추정,규칙,협정에 포함되어야 하는 사항을 구체적으로 열거하며 의무 부과,O
개발이익 환수에 관한 법률 시행규칙,9,매입가격의 신고,"④ 영 제11조제5항제1호에서 ""국토교통부령으로 정하는 증명서류""란 다음 각 호의 어느 하나에 해당하는 서류를 말한다. 다만, 제2항 후단에 따른 시장ㆍ군수ㆍ구청장의 확인으로 토지의 등기사항증명서에 적힌 접수일이 개발부담금 부과개시시점 이전임이 확인되는 경우에는 그 확인으로 증명을 갈음한다.",규칙,기본값_구조추정,해당없음,정의 규정 ('~를 말한다'),X
마약류 불법거래 방지에 관한 특례법,26,참가인의 출석 등,② 법원이 참가인의 소재를 알 수 없을 때에는 공판기일의 통지나 그 밖의 서류의 송달을 하지 아니하여도 된다.,규칙,기본값_구조추정,규칙,조건부 의무 면제 (소재 불명 시 송달 불필요),O
과학ㆍ수학ㆍ정보 교육 진흥법,4,과학·수학·정보 교육의 기본방향,④ 과학ㆍ수학ㆍ정보의 교과별 교육과 더불어 두 교과 이상의 융합을 통하여 창의적 인재를 양성할 수 있도록 교육환경이 조성되어야 한다.,규칙,기본값_구조추정,원칙,추상적 가치 실현 요청 ('~할 수 있도록 교육환경이 조성되어야 한다'),X
조세범 처벌법,10,세금계산서의 발급의무 위반 등,⑤ 제3항의 죄를 범한 자에 대해서는 정상(情狀)에 따라 징역형과 벌금형을 병과할 수 있다.,규칙,권한부여,규칙,정상 참작 시 형벌 병과 가능성 명시 (구체적 법률효과),O
석면피해구제법 시행규칙,37,석면건강관리수첩을 교부받은 자에 대한 건강검진,④ 제1항에 따른 건강검진의 주기 및 항목은 석면질병 관련 분야 전문과목 전문의의 의견을 고려하여 위원회가 정한다.,규칙,기본값_구조추정,원칙,전문가의 의견을 '고려하여' 위원회가 정하도록 하여 추상적 가치 실현 요청,X
근로기준법,33,이행강제금,⑧ 근로자는 구제명령을 받은 사용자가 이행기한까지 구제명령을 이행하지 아니하면 이행기한이 지난 때부터 15일 이내에 그 사실을 노동위원회에 알려줄 수 있다.,규칙,"구체적수치,기한규정",규칙,구체적인 사실관계(이행기한 경과 후 15일 이내) 발생 시 특정 행위(알려줄 수 있다)를 할 수 있는 권리 부여,O
규제자유특구 및 지역특화발전특구에 관한 규제특례법,94,「전시산업발전법」에 관한 특례,제94조(「전시산업발전법」에 관한 특례) 규제자유특구 내 혁신사업 또는 전략산업과 관련하여 「전시산업발전법」 제4조에 따른 주관기관이 국비 또는 지방비가 소요되는 전시시설(같은 법 제2조제4호에 따른 전시시설을 말하며 규제자유특구에 건립하는 경우에 한정한다)을 건립하려는 경우에는 같은 법 제11조제1항에도 불구하고 전시시설 건립계획에 대한 산업통상부장관과의,규칙,"조건부명령,권한부여",해당없음,"법률의 특정 조항을 인용하며, 구체적인 법률효과가 명확히 확정되지 않은 채 다른 법률과의 관계를 설명하는 부분으로 규범적 명령으로 보기 어려움",X
여객자동차 운수사업법,14,사업의 양도ㆍ양수 등,⑪ 국토교통부장관 또는 시ㆍ도지사는 제2항에 따른 양도ㆍ양수의 인가 여부를 검토하기 위하여 경찰청장에게 여객자동차운송사업을 양도하려는 자에 대한 운전경력 및 범죄경력자료의 조회를 요청할 수 있다. 이 경우 운전경력 및 범죄경력자료의 조회는 제87조제1항에 따른 자격의 취소나 정지에 필요한 정보에 한정한다.,규칙,기본값_구조추정,규칙,특정 조건(인가 여부 검토) 하에서 특정 행위(조회 요청)를 할 수 있는 권한 부여,O
김산업의 육성 및 지원에 관한 법률 시행령,2,김산업 및 김산업 종사자의 범위,"① 「김산업의 육성 및 지원에 관한 법률」(이하 ""법""이라 한다) 제2조제2호에서 ""대통령령으로 정하는 산업""이란 다음 각 호의 산업을 말한다.",해당없음,정의말한다,해당없음,정의 규정 ('~를 말한다'),O
방위산업기술 보호법 시행령,21,방위산업기술 보호지원 전담기관의 지정 등,"⑤ 방위사업청장은 법 제16조의2제3항에 따라 전담기관의 지정을 취소한 경우에는 지체 없이 해당 기관에 통지하고, 그 사실을 방위사업청 인터넷 홈페이지에 공고해야 한다.",규칙,"조건부명령,의무부과",규칙,조건부 의무 부과 (통지 및 공고 의무),O
지역방송발전지원 특별법,2,정의,① 이 법에서 사용하는 용어의 뜻은 다음과 같다.,해당없음,정의규정,해당없음,정의 규정,O
성폭력방지 및 피해자보호 등에 관한 법률 시행규칙,3,상담소의 설치신고,"③ 제2항에 따라 상담소의 설치신고를 마친 자는 상담소의 소재지, 명칭 또는 상담소의 장이 변경된 때에는 그 사유 발생일부터 14일 이내에 별지 제3호서식의 상담소 변경신고서(전자문서를 포함한다)에 다음 각 호의 서류(전자문서를 포함한다)를 첨부하여 특별자치시장ㆍ특별자치도지사 또는 시장ㆍ군수ㆍ구청장에게 제출하여야 한다.",규칙,"의무부과,구체적수치,절차규정,기한규정",규칙,구체적 기한 및 절차 명시 (변경신고 의무),O
잔류성오염물질 관리법,24,관리대상기기등의 신고 등,"① 변압기 등 대통령령으로 정하는 기기ㆍ설비ㆍ제품(이하 ""관리대상기기등""이라 한다)의 소유자는 제조사, 제조 연월일, 절연유 교체 여부 등 기후에너지환경부령으로 정하는 사항을 시ㆍ도지사에게 신고하여야 한다. 신고한 사항 중 절연유 교체 등 기후에너지환경부령으로 정하는 중요한 사항을 변경한 경우에도 또한 같다.",규칙,절차규정,규칙,조건부 의무 부과 (신고 의무),O
공직선거법,47,정당의 후보자추천,"①정당은 선거에 있어 선거구별로 선거할 정수 범위안에서 그 소속당원을 후보자(이하 ""정당추천후보자""라 한다)로 추천할 수 있다. 다만, 비례대표자치구ㆍ시ㆍ군의원의 경우에는 그 정수 범위를 초과하여 추천할 수 있다.",해당없음,약칭규정,규칙,조건부 권리 행사 (정당의 후보자 추천 권리),X
6ㆍ25 전사자유해의 발굴 등에 관한 법률,10,전사자유해의 신원확인 및 유해ㆍ유품의 보존 등,① 국방부장관은 발굴된 유해를 전사자유해로 인정한 때에는 유전자 시료(試料)를 채취하는 등 신원확인을 위한 조치를 하여야 한다.,규칙,"조건부명령,의무부과",규칙,구성요건 충족 시 명확한 의무 부과,O
자본시장과 금융투자업에 관한 법률,431,의견제출,③ 당사자 또는 이해관계인 등은 제2항에 따른 의견 진술 등을 하는 경우 변호인의 도움을 받거나 그를 대리인으로 지정할 수 있다.,규칙,권한부여,규칙,구성요건 충족 시 권리 부여,O
헌법재판소 공무원 규칙,77,선서,② 제1항의 선서는 별표 13의 선서문에 따른다.,규칙,확정명시,규칙,구체적인 절차 규정,O
암관리법,19,지역암센터의 지정 등,② 지역암센터는 다음 각 호의 사업을 수행한다.,규칙,기본값_구조추정,규칙,구성요건 충족 시 명확한 의무 부과,O
국가보훈 기본법,23,공훈선양사업의 추진,③ 국가보훈부장관은 관계기관의 장에게 제1항제3호에 따른 교육의 실시를 요청할 수 있다. 이 경우 요청을 받은 관계기관의 장은 적극적으로 협조하여야 한다.,규칙,의무부과,규칙,구성요건 충족 시 명확한 의무 부과,O
공직선거관리규칙,30,선거공보,⑩ 비례대표국회의원 및 비례대표지방의회의원선거에서 후보자의 사진ㆍ성명ㆍ학력ㆍ경력은 추천순위에 따라 게재한다.,규칙,기본값_구조추정,규칙,추천순위에 따른 명확한 게재 방식 지정,O
민법,581,종류매매와 매도인의 담보책임,②전항의 경우에 매수인은 계약의 해제 또는 손해배상의 청구를 하지 아니하고 하자없는 물건을 청구할 수 있다.,규칙,권한부여,규칙,하자없는 물건 청구라는 확정적 법률효과 명시,O
참전유공자 예우 및 단체설립에 관한 법률 시행령,6,국가보훈등록증의 발급 등,② 제1항에 따라 국가보훈등록증을 발급받은 사람은 다음 각 호의 어느 하나에 해당하는 경우에는 국가보훈부장관에게 국가보훈등록증의 재발급을 신청할 수 있다.,규칙,권한부여,규칙,특정 요건 충족 시 재발급 신청이라는 확정적 권리 부여,O
총포ㆍ도검ㆍ화약류 등의 안전관리에 관한 법률,56,이사회,"③ 이사장은 이사회를 소집하며, 그 의장이 된다.",규칙,기본값_구조추정,규칙,이사장에게 이사회 소집 및 의장직 수행이라는 확정적 의무 부과,O
채무자 회생 및 파산에 관한 법률,40,감독행정청에의 통지 등,③제2항 각호의 어느 하나에 해당하는 자는 법원에 대하여 회생절차에 관하여 의견을 진술할 수 있다.,규칙,권한부여,규칙,의견 진술이라는 확정적 권리 부여,O
경영지도사 및 기술지도사에 관한 법률,18,성실의무,① 지도사는 성실히 그 업무를 수행하며 품위를 유지하여야 한다.,규칙,의무부과,원칙,"추상적 가치 실현 요청 (성실, 품위 유지)",X
수상레저안전법 시행규칙,31,,제4장 안전관리,해당없음,장절관제목,해당없음,장 제목,O
기업도시개발 특별법,39,도시개발위원회,⑨ 이 법에서 규정한 사항 외에 위원회의 구성 및 운영 등에 필요한 사항은 대통령령으로 정한다.,해당없음,위임근거만,해당없음,단순 위임,O
개발이익 환수에 관한 법률 시행령,6,경감 대상ㆍ기준 및 경감 절차,④ 시장ㆍ군수ㆍ구청장은 제3항에 따른 개발부담금 경감 사업 및 경감 기준을 일반인이 열람할 수 있도록 해야 한다.,규칙,의무부과,규칙,구체적 의무 부과 (열람 조치),O
군인 재해보상법,25,공무상요양비 지급의 특례,① 제22조에도 불구하고 군인이 긴급한 필요 또는 그 밖의 부득이한 사정으로 요양기관이 아닌 의료기관에서 공무상요양을 받는 경우에는 국방부장관이 인정하는 경우에만 공무상요양비를 지급할 수 있다.,규칙,권한부여,규칙,조건부 의무 부과 (국방부장관 인정 시),O
장애인고용촉진 및 직업재활법,45,사무소,① 공단의 주된 사무소의 소재지는 정관으로 정한다.,규칙,기본값_구조추정,규칙,정관으로 정하도록 구체적 사항을 위임,O
외국인투자 촉진법 시행령,23,외국인투자유치협의회,④ 협의회의 회의는 제3항에 따라 그 회의에 참석할 수 있는 위원 과반수의 출석과 출석위원 과반수의 찬성으로 의결한다.,규칙,기본값_구조추정,규칙,의결 요건(과반수 출석 및 찬성)을 명확히 규정,O
산림문화ㆍ휴양에 관한 법률,12,산림레포츠지도사,"① 산림청장은 산림레포츠를 활성화하기 위하여 대통령령으로 정하는 자격기준을 갖춘 사람에게 산림레포츠를 지도하는 사람(이하 ""산림레포츠지도사""라 한다)의 자격을 부여하고 이를 육성할 수 있다.",해당없음,약칭규정,규칙,자격기준을 갖춘 자에게 자격 부여 및 육성 의무 부과,X
건설산업기본법 시행규칙,36,하자산정기준,"제36조(하자산정기준) 법 제82조제1항제1호에서 ""국토교통부령으로 정하는 규모 이상의 하자""란 하자발생액이 당해 공사금액의 1천분의 5 이상인 하자를 말한다. 다만, 1회의 하자발생액이 이에 미달하는 때에는 각각의 하자발생액의 누계액이 당해 공사금액의 1천분의 5 이상에 해당할 때에 이를 1회로 본다.",규칙,기본값_구조추정,규칙,구체적인 수치(1천분의 5)를 기준으로 하자 규모를 정의,O
